{
  "schema_version": "1.0",
  "usage_id": "usage-prov-provider_token_estimate",
  "scope": "model_invocation",
  "run_id": "run-42",
  "cost_provenance": "provider_token_estimate",
  "pricing_table_id": "gradebook.pricing@0a1b2c3d4e5f",
  "model": "anthropic/claude-sonnet-4.6",
  "input_tokens": 1200,
  "output_tokens": 340,
  "provider_cost_usd": null
}
